,author,description,genre,title
31,Gregg Easterbrook,"Is civilization teetering on the edge of a cliff? Or are we just climbing higher than ever?Most people who read the news would tell you that 2017 is one of the worst years in recent memory. We're facing a series of deeply troubling, even existential problems: fascism, terrorism, environmental collapse, racial and economic inequality, and more.Yet this narrative misses something important: by almost every meaningful measure, the modern world is better than it ever has been. In the United States, disease, crime, discrimination, and most forms of pollution are in long-term decline, while longevity and education keep rising and economic indicators are better than in any past generation. Worldwide, malnutrition and extreme poverty are at historic lows, and the risk of dying by war or violence is the lowest in human history.It's not a coincidence that we're confused--our perspectives on the world are blurred by the rise of social media, the machinations of politicians, and our own biases. Meanwhile, political reforms like the Clean Air Act and technological innovations like the hybridization of wheat have saved huge numbers of lives. In that optimistic spirit, Easterbrook offers specific policy reforms to address climate change, inequality, and other problems, and reminds us that there is real hope in conquering such challenges. In an age of discord and fear-mongering, It's Better Than It Looks will profoundly change your perspective on who we are, where we're headed, and what we're capable of.",Nonfiction,      It’s Better Than It Looks: Reasons for Optimism in an Age of Fear
32,Roseann Lake,"Forty years ago, China enacted the one-child policy, only recently relaxed. Among many other unintended consequences, it resulted in both an enormous gender imbalance—with a predicted twenty million more men than women of marriage age by 2020—and China’s first generations of only-daughters. Given the resources normally reserved for boys, these girls were pushed to study, excel in college, and succeed in careers, as if they were sons.Now living in an economic powerhouse, enough of these women have decided to postpone marriage—or not marry at all—to spawn a label: ""leftovers."" Unprecedentedly well-educated and goal-oriented, they struggle to find partners in a society where gender roles have not evolved as vigorously as society itself, and where new professional opportunities have made women less willing to compromise their careers or concede to marriage for the sake of being wed. Further complicating their search for a mate, the vast majority of China’s single men reside in and are tied to the rural areas where they were raised. This makes them geographically, economically, and educationally incompatible with city-dwelling “leftovers,” who also face difficulty in partnering with urban men, given the urban men’s general preference for more dutiful, domesticated wives.Part critique of China’s paternalistic ideals, part playful portrait of the romantic travails of China’s trailblazing women and their well-meaning parents who are anxious to see their daughters snuggled into traditional wedlock, Roseann Lake’s Leftover in China focuses on the lives of four individual women against a backdrop of colorful anecdotes, hundreds of interviews, and rigorous historical and demographic research to show how these ""leftovers"" are the linchpin to China’s future.",Nonfiction,      Leftover in China: The Women Shaping the World's Next Superpower
33,Ben Austen,"Joining the ranks of Evicted, The Warmth of Other Sons, and classic works of literary non-fiction by Alex Kotlowitz and J. Anthony Lukas, High-Risers braids personal narratives, city politics, and national history to tell the timely and epic story of Chicago’s Cabrini-Green, America’s most iconic public housing project.Built in the 1940s atop an infamous Italian slum, Cabrini-Green grew to twenty-three towers and a population of 20,000—all of it packed onto just seventy acres a few blocks from Chicago’s ritzy Gold Coast. Cabrini-Green became synonymous with crime, squalor, and the failure of government. For the many who lived there, it was also a much-needed resource—it was home. By 2011, every high-rise had been razed, the island of black poverty engulfed by the white affluence around it, the families dispersed.In this novelistic and eye-opening narrative, Ben Austen tells the story of America’s public housing experiment and the changing fortunes of American cities. It is an account told movingly though the lives of residents who struggled to make a home for their families as powerful forces converged to accelerate the housing complex’s demise. Beautifully written, rich in detail, and full of moving portraits, High-Risers is a sweeping exploration of race, class, popular culture, and politics in modern America that brilliantly considers what went wrong in our nation’s effort to provide affordable housing to the poor—and what we can learn from those mistakes.",Nonfiction,      High-Risers: Cabrini-Green and the Fate of American Public Housing
34,Raditya Dika,"Hal kedua yang gue nggak sempat kasih tahu Iman: jadi orang yang dikenal publik harus tahan dengan asumsi-asumsi orang. Misalnya, orang-orang penuh dengan asumsi yang salah. Gue kurusan dikit, dikomentarin orang yang baru ketemu, ‘Bang Radit, kurusan, deh. Buat film baru, ya?’ Gue geleng, ‘Enggak.’ Gue bilang, ‘Emang lagi diet aja.’ Dia malah balas bilang, ‘Ah, bohong! Paling abis putus cinta, kan?’Giliran gue potong rambut botak, ada orang yang ketemu gue di mall nanya, ‘Wah botak sekarang? Lagi shooting Tuyul dan Mbak Yul Reborn, ya, Bang?’ Kalau udah gitu gue cuma terkekeh sambil jawab, ‘Enggak, lagi cosplay jadi kacang Sukro, nih.’*****Ubur-ubur Lembur adalah buku komedi Raditya Dika. Bercerita tentang pengalamannya belajar hidup dari apa yang dia cintai, sambil menemukan hal remeh untuk ditertawakan di sepanjang perjalanan.Seluruh bab di dalamnya diangkat dari kisah nyata.",Nonfiction,      Ubur-ubur Lembur
35,John Heminway,"The remarkable story of one woman's search for a new life in Africa in the wake of World War II--a life that sparked a heroic career, but also hid a secret past.Dr. Anne Spoerry treated hundreds of thousands of people across rural Kenya over the span of fifty years. A member of the renowned Flying Doctors Service, the French-born Spoerry learned how to fly a plane at the age of forty-five and earned herself the cherished nickname, ""Mama Daktari""--""Mother Doctor""--from the people of Kenya. Yet few knew what drove her from post-World War II Europe to Africa. Now, in the first comprehensive account of her life, Dr. Spoerry's revered selflessness gives way to a past marked by rebellion, submission, and personal decisions that earned her another nickname--this one sinister--working as a ""doctor"" in a Nazi concentration camp.In Full Flight explores the question of whether it is possible to rewrite one's troubled past simply by doing good in the present. Informed by Spoerry's own journals, a trove of previously untapped files, and numerous interviews with those who knew her in Europe or Africa, John Heminway takes readers on a remarkable journey across a haunting African landscape and into a dramatic life punctuated by both courage and weakness and driven by a powerful need to atone.",Nonfiction,      In Full Flight: A Story of Africa and Atonement
36,Amy Thomas,"From the author of Paris, My Sweet comes the story of a modern woman embracing love, motherhood, and all the courses life has to offer,On an island where finding love can be just as hard as finding a dinner reservation on a Friday night, Amy Thomas never imagined a family would fit into her lifestyle. So when Amy finds herself turning forty, moving to Brooklyn, and making way for a baby with a new man in her life, she realizes that starting over may be her biggest opportunity yet.But how do you balance staying out all night dancing with staying up all night soothing a baby? Can a lifelong city girl trade in spontaneity for domesticity? Set amid the backdrop of Brooklyn and Manhattan's foodie scenes, Amy sets out to make her second act even sweeter than the first.",Autobiography,"      Brooklyn in Love: A Delicious Memoir of Food, Family, and Finding Yourself"
37,Yasha Levine,"The internet is the most effective weapon the government has ever built.In this fascinating book, investigative reporter Yasha Levine uncovers the secret origins of the internet, tracing it back to a Pentagon counterinsurgency surveillance project.A visionary intelligence officer, William Godel, realized that the key to winning the war in Vietnam was not outgunning the enemy, but using new information technology to understand their motives and anticipate their movements. This idea--using computers to spy on people and groups perceived as a threat, both at home and abroad--drove ARPA to develop the internet in the 1960s, and continues to be at the heart of the modern internet we all know and use today. As Levine shows, surveillance wasn't something that suddenly appeared on the internet; it was woven into the fabric of the technology.But this isn't just a story about the NSA or other domestic programs run by the government. As the book spins forward in time, Levine examines the private surveillance business that powers tech-industry giants like Google, Facebook, and Amazon, revealing how these companies spy on their users for profit, all while doing double duty as military and intelligence contractors. Levine shows that the military and Silicon Valley are effectively inseparable: a military-digital complex that permeates everything connected to the internet, even coopting and weaponizing the antigovernment privacy movement that sprang up in the wake of Edward Snowden.With deep research, skilled storytelling, and provocative arguments, Surveillance Valley will change the way you think about the news--and the device on which you read it.",Nonfiction,      Surveillance Valley: The Secret Military History of the Internet
38,Kevin Toolis,"An intimate, lyrical look at the ancient rite of the Irish wake--and the Irish way of overcoming our fear of deathDeath is a whisper for most of us. Instinctively we feel we should dim the lights, pull the curtains, and speak softly. But on a remote island off the coast of Ireland's County Mayo, death has a louder voice.Each day, along with reports of incoming Atlantic storms, the local radio runs a daily roll call of the recently departed. The islanders go in great numbers, young and old alike, to be with their dead. They keep vigil with the corpse and the bereaved company through the long hours of the night. They dig the grave with their own hands and carry the coffin on their own shoulders. The islanders cherish the dead--and amid the sorrow, they celebrate life, too.In My Father's Wake, acclaimed author and award-winning filmmaker Kevin Toolis unforgettably describes his own father's wake and explores the wider history and significance of this ancient and eternal Irish ritual. Perhaps we, too, can all find a better way to deal with our mortality--by living and loving as the Irish do.",Autobiography,"      My Father's Wake: How the Irish Teach Us to Live, Love, and Die"
39,Zak Dychtwald,"The 24-year old author, who is fluent in Chinese, examines the future of China through the lens of the Jiu Ling Hou--the generation born after 1990.A close up look at the Chinese generation born after 1990 exploring through personal encounters how young Chinese feel about everything from money and sex, to their government, the West, and China's shifting role in the world--not to mention their love affair with food, karaoke, and travel. Set primarily in the Eastern 2nd tier city of Suzhou and the budding Western metropolis of Chengdu, the book charts the touchstone issues this young generation faces. From single-child pressure, to test taking madness and the frenzy to buy an apartment as a prerequisite to marriage, from one-night-stands to an evolving understanding of family, Young China offers a fascinating portrait of the generation who will define what it means to be Chinese in the modern era.Zak Dychtwald was twenty when he first landed in China. He spent years deeply immersed in the culture, learning the language and hanging out with his peers, in apartment shares and hostels, on long train rides and over endless restaurant meals.",Nonfiction,      Young China: How the Restless Generation Will Change Their Country and the World
40,Adam Winkler,"We the Corporations chronicles the astonishing story of one of the most successful yet least well-known “civil rights movements” in American history. Hardly oppressed like women and minorities, business corporations, too, have fought since the nation’s earliest days to gain equal rights under the Constitution—and today have nearly all the same rights as ordinary people.Exposing the historical origins of Citizens United and Hobby Lobby, Adam Winkler explains how those controversial Supreme Court decisions extending free speech and religious liberty to corporations were the capstone of a centuries-long struggle over corporate personhood and constitutional protections for business. Beginning his account in the colonial era, Winkler reveals the profound influence corporations had on the birth of democracy and on the shape of the Constitution itself. Once the Constitution was ratified, corporations quickly sought to gain the rights it guaranteed. The first Supreme Court case on the rights of corporations was decided in 1809, a half-century before the first comparable cases on the rights of African Americans or women. Ever since, corporations have waged a persistent and remarkably fruitful campaign to win an ever-greater share of individual rights.Although corporations never marched on Washington, they employed many of the same strategies of more familiar civil rights struggles: civil disobedience, test cases, and novel legal claims made in a purposeful effort to reshape the law. Indeed, corporations have often been unheralded innovators in constitutional law, and several of the individual rights Americans hold most dear were first secured in lawsuits brought by businesses.Winkler enlivens his narrative with a flair for storytelling and a colorful cast of characters: among others, Daniel Webster, America’s greatest advocate, who argued some of the earliest corporate rights cases on behalf of his business clients; Roger Taney, the reviled Chief Justice, who surprisingly fought to limit protections for corporations—in part to protect slavery; and Roscoe Conkling, a renowned politician who deceived the Supreme Court in a brazen effort to win for corporations the rights added to the Constitution for the freed slaves. Alexander Hamilton, Teddy Roosevelt, Huey Long, Ralph Nader, Louis Brandeis, and even Thurgood Marshall all played starring roles in the story of the corporate rights movement.In this heated political age, nothing can be timelier than Winkler’s tour de force, which shows how America’s most powerful corporations won our most fundamental rights and turned the Constitution into a weapon to impede the regulation of big business.",Nonfiction,      We the Corporations: How American Businesses Won Their Civil Rights
41,Cheston Knapp,"For fans of John Jeremiah Sullivan and Wells Tower, a “glittering,” (Leslie Jamison), “always smart, often hilarious, and ultimately transcendent” (Anthony Doerr) linked essay collection from the managing editor of Tin House that brilliantly explores the nature of identity.Daring and wise, hilarious and tender, Cheston Knapp’s exhilarating collection of seven linked essays, Up Up, Down Down, tackles the Big Questions through seemingly unlikely avenues. In his dexterous hands, an examination of a local professional wrestling promotion becomes a meditation on pain and his relationship with his father. A profile of UFO enthusiasts ends up probing his history in the church and, more broadly, the nature and limits of faith itself. Attending an adult skateboarding camp launches him into a virtuosic analysis of nostalgia. And the shocking murder of a neighbor expands into an interrogation of our culture’s prevailing ideas about community and the way we tell the stories of our lives. Even more remarkable, perhaps, is the way he manages to find humanity in a damp basement full of frat boys. Taken together, the essays in Up Up, Down Down amount to a chronicle of Knapp’s coming-of-age, a young man’s journey into adulthood, late-onset as it might appear. He presents us with formative experiences from his childhood to marriage that echo throughout the collection, and ultimately tilts at what may be the Biggest Q of them all: what are the hazards of becoming who you are? With “an ordnance of wit” (Wells Tower) and “a prose style that feels both extravagant and exact, and a big, booming heart” (Maggie Nelson), Up Up, Down Down signals the arrival of a truly one-of-a-kind voice.",Writing,"      Up Up, Down Down: Essays"
42,Sarah B. Pomeroy,"In 1660, at the age of thirteen, Maria Sibylla Merian (1647-1717) began her study of butterfly metamorphosis—years before any other scientist published an accurate description of the process. Later, Merian and her daughter ventured thousands of miles from their home in the Netherlands to the rainforests of South America seeking new and amazing insects to observe and illustrate.     Years after her death, Merian’s accurate and beautiful illustrations were used by scientists, including Carl Linnaeus, to classify species, and today her prints and paintings are prized by museums around the world. More than a dozen species of plants and animals are named after Merian.     The first Merian biography written for ages 10 and up, this book will enchant budding scientists and artists alike. Readers will be inspired by Merian’s talent, curiosity, and grit and will be swept up in the story of her life, which was adventurous even by today’s standards.     With its lively text, quotations from Merian’s own study book, and fascinating sidebars on history, art, and science, this volume is an ideal STEAM title for readers of all ages and interests.",Biography,"      Maria Sibylla Merian: Artist, Scientist, Adventurer"
43,Martin Doyle,"How rivers have shaped American politics, economics, and society from the beginnings of the Republic to today.In this fresh and powerful work of environmental history, Martin Doyle explores how rivers have often been the source of arguments at the heart of the American experiment—over federalism, taxation, regulation, conservation, and development. Doyle tells the epic story of America and its rivers, from the U.S. Constitution’s roots in interstate river navigation, the origins of the Army Corps of Engineers, the discovery of gold in 1848, and the construction of the Hoover Dam and the TVA during the New Deal, to the failure of the levees in Hurricane Katrina. And through encounters with experts all over the country—a Mississippi River tugboat captain, an Erie Canal lock operator, a western rancher fighting for water rights—Doyle reveals how we’ve dammed, raised, rerouted, channelized, and even “re-meandered” our rivers.",History,      The Source: How Rivers Made America and America Remade Its Rivers
44,Daniel Heath Justice,"Part survey of the field of Indigenous literary studies, part cultural history, and part literary polemic, Why Indigenous Literatures Matter asserts the vital significance of literary expression to the political, creative, and intellectual efforts of Indigenous peoples today. In considering the connections between literature and lived experience, this book contemplates four key questions at the heart of Indigenous kinship traditions: How do we learn to be human? How do we become good relatives? How do we become good ancestors? How do we learn to live together? Blending personal narrative and broader historical and cultural analysis with close readings of key creative and critical texts, Justice argues that Indigenous writers engage with these questions in part to challenge settler-colonial policies and practices that have targeted Indigenous connections to land, history, family, and self. More importantly, Indigenous writers imaginatively engage the many ways that communities and individuals have sought to nurture these relationships and project them into the future.  This provocative volume challenges readers to critically consider and rethink their assumptions about Indigenous literature, history, and politics while never forgetting the emotional connections of our shared humanity and the power of story to effect personal and social change. Written with a generalist reader firmly in mind, but addressing issues of interest to specialists in the field, this book welcomes new audiences to Indigenous literary studies while offering more seasoned readers a renewed appreciation for these transformative literary traditions.",Criticism,      Why Indigenous Literatures Matter
45,Changiz Lahidji,"Over 100 combat missions, 24 years as a Green Beret―Full Battle Rattle tells the legend of a soldier who served America in every war since Vietnam.Master Sergeant Changiz Lahidji served on Special Forces A teams longer than anyone in history, completing over a hundred combat missions in Afghanistan. Changiz is a Special Forces legend. He also happens to be the first Muslim Green Beret.Changiz served this country starting with Operation Eagle Claw in 1980, when he entered Tehran on a one-man mission to spy on Iranian soldiers guarding the US Embassy where 52 US diplomats were being held hostage. Three years later, he was in Beirut, Lebanon when a suicide car bomb exploded in front of the US Embassy killing 83 people. Weeks after that, he was shot by Hezbollah terrorists on a night mission.In Operation Iraqi Freedom, he led a convoy that was ambushed on its way to Fallujah. He was clearing houses in Mogadishu, Somalia on October, 1993 when a US Black Hawk helicopter was shot down 50 feet away from him in the incident that inspired Black Hawk Down. In 2002, he dressed as a farmer and snuck into Eastern Afghanistan and located Osama Bin Laden for the CIA.Along the way, Changiz earned numerous commendations, including the Special Forces Legion of Merit, Purple Hearts, and many others. Last year he was nominated for induction in Military Intelligence Hall of Fame and cited as “the finest noncommissioned officer to ever serve in Special Forces.”His story is an amazing tale of perseverance and courage, of combat and one man’s love of his adopted country.",Nonfiction,      Full Battle Rattle: My Story as the Longest-Serving Special Forces A-Team Soldier in American History
46,Catherine  Hewitt,"Catherine Hewitt's richly told biography of Suzanne Valadon, the illegitimate daughter of a provincial linen maid who became famous as a model for the Impressionists and later as a painter in her own right.In the 1880s, Suzanne Valadon was considered the Impressionists’ most beautiful model. But behind her captivating façade lay a closely-guarded secret.Suzanne was born into poverty in rural France, before her mother fled the provinces, taking her to Montmartre. There, as a teenager Suzanne began posing for—and having affairs with—some of the age’s most renowned painters. Then Renoir caught her indulging in a passion she had been trying to conceal: the model was herself a talented artist.Some found her vibrant still lifes and frank portraits as shocking as her bohemian lifestyle. At eighteen, she gave birth to an illegitimate child, future painter Maurice Utrillo. But her friends Toulouse-Lautrec and Degas could see her skill. Rebellious and opinionated, she refused to be confined by tradition or gender, and in 1894, her work was accepted to the Salon de la Société Nationale des Beaux-Arts, an extraordinary achievement for a working-class woman with no formal art training.Renoir’s Dancer tells the remarkable tale of an ambitious, headstrong woman fighting to find a professional voice in a male-dominated world.",Biography,      Renoir's Dancer: The Secret Life of Suzanne Valadon
