,author,description,genre,title
65,Johann Hari,"From the New York Times bestselling author of Chasing the Scream: The First and Last Days of the War on Drugs, a startling challenge to our thinking about depression and anxiety.Award-winning journalist Johann Hari suffered from depression since he was a child and started taking antidepressants when he was a teenager. He was told—like his entire generation—that his problem was caused by a chemical imbalance in his brain. As an adult, trained in the social sciences, he began to investigate this question—and he learned that almost everything we have been told about depression and anxiety is wrong. Across the world, Hari discovered social scientists who were uncovering the real causes—and they are mostly not in our brains, but in the way we live today. Hari’s journey took him from the people living in the tunnels beneath Las Vegas, to an Amish community in Indiana, to an uprising in Berlin—all showing in vivid and dramatic detail these new insights. They lead to solutions radically different from the ones we have been offered up until now.Just as Chasing the Scream transformed the global debate about addiction, with over twenty million views for his TED talk and the animation based on it, Lost Connections will lead us to a very different debate about depression and anxiety—one that shows how, together, we can end this epidemic.",Nonfiction,      Lost Connections: Uncovering the Real Causes of Depression - and the Unexpected Solutions
66,Steven Levitsky,"A bracing, revelatory look at the demise of liberal democracies around the world--and a road map for rescuing our ownDonald Trump's presidency has raised a question that many of us never thought we'd be asking: Is our democracy in danger? Harvard professors Steven Levitsky and Daniel Ziblatt have spent more than twenty years studying the breakdown of democracies in Europe and Latin America, and they believe the answer is yes. Democracy no longer ends with a bang--in a revolution or military coup--but with a whimper: the slow, steady weakening of critical institutions, such as the judiciary and the press, and the gradual erosion of long-standing political norms. The good news is that there are several exit ramps on the road to authoritarianism. The bad news is that, by electing Trump, we have already passed the first one.Drawing on decades of research and a wide range of historical and global examples, from 1930s Europe to contemporary Hungary, Turkey, and Venezuela, to the American South during Jim Crow, Levitsky and Ziblatt show how democracies die--and how ours can be saved.",Politics,      How Democracies Die: What History Reveals About Our Future
67,Catherine Kerrison,"
The remarkable untold story of Thomas Jefferson's three daughters - two white and free, one black and enslaved - and the divergent paths they forged in a newly independent America.
Thomas Jefferson had three daughters: Martha and Maria by his wife, Martha Wayles Jefferson, and Harriet by his slave Sally Hemings. In Jefferson's Daughters, Catherine Kerrison, a scholar of early American and women's history, recounts the remarkable journey of these three women - and how their struggle to define themselves reflects both the possibilities and the limitations that resulted from the American Revolution. Although the three women shared a father, the similarities end there. Martha and Maria received a fine convent school education while they lived with their father during his diplomatic posting in Paris - a hothouse of intellectual ferment whose celebrated salonnières are vividly brought to life in Kerrison's narrative. Once they returned home, however, the sisters found their options limited by the laws and customs of early America. Harriet Hemings followed a different path. She escaped slavery - apparently with the assistance of Jefferson himself. Leaving Monticello behind, she boarded a coach and set off for a decidedly uncertain future. For this groundbreaking triple biography, Kerrison has uncovered never-before-published documents written by the Jefferson sisters when they were in their teens, as well as letters written by members of the Jefferson and Hemings families. She has interviewed Hemings family descendants (and, with their cooperation, initiating DNA testing) and searched for possible descendants of Harriet Hemings.The eventful lives of Thomas Jefferson's daughters provide a unique vantage point from which to examine the complicated patrimony of the American Revolution itself. The richly interwoven story of these three strong women and their fight to shape their own destinies sheds new light on the ongoing movement toward human rights in America - and on the personal and political legacy of one of our most controversial Founding Fathers.",Nonfiction,"      Jefferson's Daughters: Three Sisters, White and Black, in a Young America"
68,John Leland,"An extraordinary look at what it means to grow old and a heartening guide to well-being, Happiness Is a Choice You Make weaves together the stories and wisdom of six New Yorkers who number among the ""oldest old""-- those eighty-five and up.In 2015, when the award-winning journalist John Leland set out on behalf of The New York Times to meet members of America's fastest-growing age group, he anticipated learning of challenges, of loneliness, and of the deterioration of body, mind, and quality of life. But the elders he met took him in an entirely different direction. Despite disparate backgrounds and circumstances, they each lived with a surprising lightness and contentment. The reality Leland encountered upended contemporary notions of aging, revealing the late stages of life as unexpectedly rich and the elderly as incomparably wise.Happiness Is a Choice You Make is an enduring collection of lessons that emphasizes, above all, the extraordinary influence we wield over the quality of our lives. With humility, heart, and wit, Leland has crafted a sophisticated and necessary reflection on how to ""live better""--informed by those who have mastered the art.",Nonfiction,      Happiness Is a Choice You Make: Lessons from a Year Among the Oldest Old
69,David Frum,"A New York Times Bestseller!Bestselling author, former White House speechwriter, and Atlantic columnist and media commentator David Frum explains why President Trump has undermined our most important institutions in ways even the most critical media has missed, in this thoughtful and hard-hitting book that is a warning for democracy and America’s future.""From Russia to South Africa, from Turkey to the Philippines, from Venezuela to Hungary, authoritarian leaders have smashed restraints on their power. Media freedom and judicial independence have eroded. The right to vote remains, but the right to have one’s vote counted fairly may not. Until the US presidential election of 2016, the global decline of democracy seemed a concern for other peoples in other lands. . . . That complacent optimism has been upended by the political rise of Donald Trump. The crisis is upon Americans, here and now.""Quietly, steadily, Trump and his administration are damaging the tenets and accepted practices of American democracy, perhaps irrevocably. As he and his family enrich themselves, the presidency itself falls into the hands of the generals and financiers who surround him.While much of the country has been focused on Russia, David Frum has been collecting the lies, obfuscations, and flagrant disregard for the traditional limits placed on the office of the presidency. In Trumpocracy, he documents how Trump and his administration are steadily damaging the tenets and accepted practices of American democracy. During his own White House tenure as George W. Bush’s speechwriter, Frum witnessed the ways the presidency is limited not by law but by tradition, propriety, and public outcry, all now weakened. Whether the Trump presidency lasts two, four, or eight more years, he has changed the nature of the office for the worse, and likely for decades.In this powerful and eye-opening book, Frum makes clear that the hard work of recovery starts at home. Trumpocracy outlines how Trump could push America toward illiberalism, what the consequences could be for our nation and our everyday lives, and what we can do to prevent it.",Politics,      Trumpocracy: The Corruption of the American Republic
70,Gabrielle Bernstein,"From #1 New York Times bestselling author Gabrielle Bernstein comes a clear, proactive, step-by-step process to release the beliefs that hold you back from living a better life.This six-step practice offers many promises. Petty resentments will disappear, compassion will replace attack, the energy of resistance will transform into freedom and you’ll feel more peace and happiness than you’ve ever known. I can testify to these results because I’ve lived them. I’ve never felt more freedom and joy than I have when writing and practicing these steps.My commitment to healing my own relationship to judgment has changed my life in profound ways. My awareness of my judgment has helped me become a more mindful and conscious person. My willingness to heal these perceptions has set me free. I have been able to let go of resentments and jealousies, I can face pain with curiosity and love, and I forgive others and myself much more easily. Best of all, I have a healthy relationship to judgment so that I can witness when it shows up and I can use these steps to quickly return to love.The Judgment Detox is an interactive six-step process that calls on spiritual principles from the text A Course in Miracles, Kundalini yoga, the Emotional Freedom Technique (aka Tapping), meditation, prayer and metaphysical teachings. I’ve demystified these principles to make them easy to commit to and apply in your daily life. Each lesson builds upon the next to support true healing. When you commit to following the process and become willing to let go, judgment, pain and suffering will begin to dissolve.And the miracles will keep coming. Once you begin to feel better you start to release your resistance to love. The more you practice these steps, the more love enters into your consciousness and into your energetic vibration. When you’re in harmony with love, you receive more of what you want. Your energy attracts its likeness. So when you shift your energy from defensive judgment to free-flowing love your life gets awesome. You’ll attract exactly what you need, your relationships will heal, your health will improve and you’ll feel safer and more secure. One loving thought at a time creates a miracle. Follow these steps to clear all blocks, spread more love and live a miraculous life.",Self Help,      Judgment Detox: Release the Beliefs That Hold You Back from Living A Better Life
71,Laurie Gwen Shapiro,"The spectacular, true story of a scrappy teenager from New York’s Lower East Side who stowed away on the Roaring Twenties’ most remarkable feat of science and daring: an expedition to Antarctica.It was 1928: a time of illicit booze, of Gatsby and Babe Ruth, of freewheeling fun. The Great War was over and American optimism was higher than the stock market. What better moment to launch an expedition to Antarctica, the planet’s final frontier? There wouldn’t be another encounter with an unknown this magnificent until Neil Armstrong stepped onto the moon.Everyone wanted in on the adventure. Rockefellers and Vanderbilts begged to be taken along as mess boys, and newspapers across the globe covered the planning’s every stage. And then, the night before the expedition’s flagship set off, Billy Gawronski—a mischievous, first-generation New York City high schooler desperate to escape a dreary future in the family upholstery business—jumped into the Hudson River and snuck aboard.Could he get away with it?From the soda shops of New York’s Lower East Side to the dance halls of sultry Francophone Tahiti, all the way to Antarctica’s blinding white and deadly freeze, Laurie Gwen Shapiro’s The Stowaway takes you on the unforgettable voyage of a plucky young stowaway who became a Jazz Age celebrity, a mascot for an up-by-your bootstraps era.",Nonfiction,      The Stowaway: A Young Man’s Extraordinary Adventure to Antarctica
72,Ronen Bergman,"The first definitive history of the Mossad, Shin Bet, and the IDF’s targeted killing programs, from the man hailed by David Remnick as “arguably [Israel’s] best investigative reporter” The Talmud says: “If someone comes to kill you, rise up and kill him first.” This instinct to take every measure, even the most aggressive, to defend the Jewish people is hardwired into Israel’s DNA. From the very beginning of its statehood in 1948, protecting the nation from harm has been the responsibility of its intelligence community and armed services, and there is one weapon in their vast arsenal that they have relied upon to thwart the most serious threats: Targeted assassinations have been used countless times, on enemies large and small, sometimes in response to attacks against the Israeli people and sometimes preemptively. In this page-turning, eye-opening book, journalist and military analyst Ronen Bergman offers a riveting inside account of the targeted killing programs—their successes, their failures, and the moral and political price exacted on the men and women who approved and carried out the missions.Bergman has gained the exceedingly rare cooperation of many current and former members of the Israeli government, including Prime Ministers Shimon Peres, Ehud Barak, Ariel Sharon, and Benjamin Netanyahu, as well as high-level figures in the country’s military and intelligence services: the IDF (Israel Defense Forces), the Mossad (the world’s most feared intelligence agency), Caesarea (a “Mossad within the Mossad” that carries out attacks on the highest-value targets), and the Shin Bet (an internal security service that implemented the largest targeted assassination campaign ever, in order to stop what had once appeared to be unstoppable: suicide terrorism).Including never-before-reported, behind-the-curtain accounts of key operations, and based on hundreds of on-the-record interviews and thousands of files to which Bergman has gotten exclusive access over his decades of reporting, Rise and Kill First brings us deep into the heart of Israel’s most secret activities. Bergman traces, from statehood to the present, the gripping events and thorny ethical questions underlying Israel’s targeted killing campaign, which has shaped the Israeli nation, the Middle East, and the entire world.",History,      Rise and Kill First: The Inside Story and Secret Operations of Israel's Assassination Program
73,Shoba Narayan,"
The elevator door opens. A cow stands inside, angled diagonally to fit. It doesn’t look uncomfortable, merely impatient. “It is for the housewarming ceremony on the third floor,” explains the woman who stands behind the cow, holding it loosely with a rope. She has the sheepish look of a person caught in a strange situation who is trying to act as normal as possible. She introduces herself as Sarala and smiles reassuringly. The door closes. I shake my head and suppress a grin. It is good to be back.
 When Shoba Narayan—who has just returned to India with her husband and two daughters after years in the United States—asks whether said cow might bless her apartment next, it is the beginning of a beautiful friendship between our author and Sarala, who also sells fresh milk right across the street from that thoroughly modern apartment building. The two women connect over not only cows but also family, food, and life. When Shoba agrees to buy Sarala a new cow, they set off looking for just the right heifer, and what was at first a simple economic transaction becomes something much deeper, though never without a hint of slapstick.The Milk Lady of Bangalore immerses us in the culture, customs, myths, religion, sights, and sounds of a city in which the twenty-first century and the ancient past coexist like nowhere else in the world. It’s a true story of bridging divides, of understanding other ways of looking at the world, and of human connections and animal connections, and it’s an irresistible adventure of two strong women and the animals they love.",Nonfiction,      The Milk Lady of Bangalore: An Unexpected Adventure
74,David Cay Johnston,"The Trump administration is remaking the government. It's Even Worse Than You Think: What the Trump Administration Is Doing to America tells readers exactly how it is making America worse again.Bestselling author and longtime Trump observer David Cay Johnston shines a light on the political termites who have infested our government under the Trump Administration, destroying it from within and compromising our jobs, safety, finances, and more.No journalist knows Donald Trump better than David Cay Johnston, who has been following him since 1988. It's Even Worse Than You Think: What the Trump Administration Is Doing to America goes inside the administration to show how the federal agencies that touch the lives of all Americans are being undermined. Here is just some of what you will learn:The Wall. Mexican President Enrique Pena Nieto told President Trump that Mexico will never pay for the border wall. So, Trump is proposing putting a tariff on Mexican imports. But a tariff will simply raise the price of Mexican goods in the US, meaning American consumers will end up paying for the wall—if it ever gets built.Climate Change. Welcome to the new EPA, run by Scott Pruitt, a lawyer who has spent much of his career trying to destroy the agency he now heads. Secrecy reigns at the new EPA because Pruitt meets with industry executives to find out which clean air and clean water provisions they most want to roll back, and keeps staffers in the dark to make sure these pro-pollution plans don’t leak prematurely.Stocking the Swamp. Contrary to his promise to “drain the swamp” in Washington, DC, Trump has filled his cabinet with millionaires and billionaires, from Treasury Secretary Steven Mnuchin, a Goldman Sachs and hedge fund veteran who made much of his fortune foreclosing on homeowners to billionaire heiress Education Secretary Betsy DeVos, who has already put the interests of bankers ahead of debt-burdened students and their families.The Kleptocracy. Under Donald Trump conflict of interest is passé. When Trump isn’t in Washington, he stays at one of his properties, where the taxpayers pick up the tab for staffers, Secret Service, and so on, all at full price. And back in Washington, everyone now knows that the Trump International Hotel is the only place to stay if you want to do business with the administration. Meanwhile sons Donald Jr. and Eric run an eyes-wide-open blind trust of Trump holdings to avoid the appearance of conflict of interest—but not the reality.",Politics,      It's Even Worse Than You Think: What the Trump Administration Is Doing to America
75,Virginia Eubanks,"A powerful investigative look at data-based discrimination—and how technology affects civil and human rights and economic equityThe State of Indiana denies one million applications for healthcare, foodstamps and cash benefits in three years—because a new computer system interprets any mistake as “failure to cooperate.” In Los Angeles, an algorithm calculates the comparative vulnerability of tens of thousands of homeless people in order to prioritize them for an inadequate pool of housing resources. In Pittsburgh, a child welfare agency uses a statistical model to try to predict which children might be future victims of abuse or neglect.Since the dawn of the digital age, decision-making in finance, employment, politics, health and human services has undergone revolutionary change. Today, automated systems—rather than humans—control which neighborhoods get policed, which families attain needed resources, and who is investigated for fraud. While we all live under this new regime of data, the most invasive and punitive systems are aimed at the poor.In Automating Inequality, Virginia Eubanks systematically investigates the impacts of data mining, policy algorithms, and predictive risk models on poor and working-class people in America. The book is full of heart-wrenching and eye-opening stories, from a woman in Indiana whose benefits are literally cut off as she lays dying to a family in Pennsylvania in daily fear of losing their daughter because they fit a certain statistical profile.The U.S. has always used its most cutting-edge science and technology to contain, investigate, discipline and punish the destitute. Like the county poorhouse and scientific charity before them, digital tracking and automated decision-making hide poverty from the middle-class public and give the nation the ethical distance it needs to make inhumane choices: which families get food and which starve, who has housing and who remains homeless, and which families are broken up by the state. In the process, they weaken democracy and betray our most cherished national values.This deeply researched and passionate book could not be more timely.Naomi Klein: ""This book is downright scary.""Ethan Zuckerman, MIT: ""Should be required reading.""Dorothy Roberts, author of Killing the Black Body: ""A must-read for everyone concerned about modern tools of inequality in America.""Astra Taylor, author of The People's Platform: ""This is the single most important book about technology you will read this year.""",Nonfiction,"      Automating Inequality: How High-Tech Tools Profile, Police, and Punish the Poor"
76,Simon Baatz,"From New York Times bestselling author Simon Baatz, the first comprehensive account of the murder that shocked the world.In 1901 Evelyn Nesbit, a chorus girl in the musical Florodora, dined alone with the architect Stanford White in his townhouse on 24th Street in New York. Nesbit, just sixteen years old, had recently moved to the city. White was forty-seven and a principal in the prominent architectural firm McKim, Mead & White. As the foremost architect of his day, he was a celebrity, responsible for designing countless landmark buildings in Manhattan. That evening, after drinking champagne, Nesbit lost consciousness and awoke to find herself naked in bed with White. Telltale spots of blood on the bed sheets told her that White had raped her.She told no one about the rape until, several years later, she confided in Harry Thaw, the millionaire playboy who would later become her husband. Thaw, thirsting for revenge, shot and killed White in 1906 before hundreds of theatergoers during a performance in Madison Square Garden, a building that White had designed.The trial was a sensation that gripped the nation. Most Americans agreed with Thaw that he had been justified in killing White, but the district attorney expected to send him to the electric chair. Evelyn Nesbit's testimony was so explicit and shocking that Theodore Roosevelt himself called on the newspapers not to print it verbatim. The murder of White cast a long shadow: Harry Thaw later attempted suicide, and Evelyn Nesbit struggled for many years to escape an addiction to cocaine. The Girl on the Velvet Swing, a tale of glamour, excess, and danger, is an immersive, fascinating look at an America dominated by men of outsize fortunes and by the the women who were their victims.",Nonfiction,"      The Girl on the Velvet Swing: Sex, Murder, and Madness at the Dawn of the Twentieth Century"
77,Nichi Hodgson,"'A new approach to romance... The heroines of Regency novels could teach today's young women a trick or two' Sunday TimesDating has never been easy. The road to true love has always been rutted with heartbreak, but do we have it any easier today? How did Victorians 'come out'? How did love blossom in war-torn Europe? And why did 80s video-dating never take off?Bursting with little-known facts and tantalizing tales of lovelorn men and besotted women, Nichi Hodgson's intriguing history of amorous relationships, from enamoured Georgians to frenziedly swiping millennials (and everyone in between) may leave you grateful that you live - and love - today.",Nonfiction,      The Curious History of Dating: From Jane Austen to Tinder
